doc_id,text,assigned_topic,topic_probability
1,Bitcoin and Ethereum are leading cryptocurrencies. Blockchain technology is fascinating.,1,0.99159926
2,The stock market saw a dip yesterday due to interest rate hikes. Investing requires patience.,2,0.9912665
3,"My favorite sport is football, followed closely by basketball. I watch the Champions League every week.",1,0.9946085
4,I enjoy trading stocks and reading financial news. The market is very volatile.,1,0.99262786
5,I need to buy a new football and practice my shooting skills. Sports are healthy.,1,0.99343216
6,Decentralized finance relies on smart contracts. Ethereum platform is highly scalable.,2,0.9884084
